<?xml version="1.0" encoding="UTF-8"?>
<!DOCTYPE script PUBLIC "-//DTF/DTF XML Script V1.0//EN" "dtf.dtd">
<script name="storage">
    <info>
        <author>
            <name>Rodney Gomes</name>
            <email>rodney.gomes@sun.com</email>
        </author>
        <description>Unit test for the storage tag.</description>
    </info>
   
   	<local> 
  		<echo>Create a bunch of storages.</echo>
        <createstorage id="INPUT" path="${dtf.xml.path}/input"/>
        <loadproperties uri="storage://INPUT/ut.properties"/>
  	</local>
  	<for range="[1..10]" property="id">
        <local>	
            <createstorage id="STORAGE${id}" path="${dtf.xml.path}/output/STORE${id}"/>
        </local>
    </for>
   
   	<try> 
        <local>
            <createstorage id="STORAGE5" path="${dtf.xml.path}/output"/>
        </local>
        <catch exception="${dtf.StorageException}" property="message">
        	<local>
        		<echo>Caught correction exception: ${message}</echo>
        	</local>
        </catch>
    </try>
    
</script>
