<?xml version="1.0" encoding="UTF-8"?>
<!DOCTYPE script PUBLIC "-//DTF/DTF XML Script V1.0//EN" "dtf.dtd">
<script name="testsuite-sub">
	<info>
		<author>
			<name>Rodney Gomes</name>
			<email>rodney.gomes@sun.com</email>
		</author>
		<description>sub test suite used by test suite unit test.</description>
	</info>

	<local>
        <createstorage id="OUTPUT" path="${dtf.xml.path}/output"/>
        <createstorage id="INPUT" path="${dtf.xml.path}"/>
	</local>
	
	<testsuite name="testsuite2" continueOnFailure="true">
		<property name="testcase.name" value="testcase-sub1"/>
		<testscript uri="storage://INPUT/testcase.xml"/>		

		<property name="testcase.name" value="testcase-sub2"/>
		<testscript uri="storage://INPUT/testcase.xml"/>		
		
		<property name="testcase.name" value="testcase-sub3"/>
		<testscript uri="storage://INPUT/testcase.xml"/>		
	</testsuite>
</script>
