<?xml version="1.0" encoding='UTF-8'?>
<!DOCTYPE script PUBLIC "-//DTF/DTF XML Script V1.0//EN" "dtf.dtd">

<script name="graph">
	<info>
		<author>
			<name>Rodney Gomes</name>
			<email>rodney.gomes@sun.com</email>
		</author>
		<description>
        Analyze and create graphs of the results of Honeycomb performance tests.</description>
	</info>

	<local>
		<createstorage id="INPUT" path="${dtf.xml.path}/input" />
		<createstorage id="OUTPUT" path="${dtf.xml.path}/output" />

	    <loadproperties uri="storage://INPUT/hc.properties"/> 
        
        <property name="runid" value="notset"/>
	</local>

    <function name="graphOpsPerSecond">
        <param name="operation.name" type="required"/>
        <param name="operation.event" type="required"/>
        <param name="operation.field" type="required"/>
        <param name="operation.units" type="required"/>
        
        <param name="filesize" type="required"/>
        <param name="client.stats.uri" type="required"/>
        <param name="output" type="required"/>
       
        <if>
            <eq op1="${runid}" op2="notset"/>
            <then>
                <query uri="${client.stats.uri}"
                       type="txt"
                       event="${operation.event}"
                       cursor="cscursor">
                    <select>
                        <field name="${operation.field}"/>
                        <field name="client"/>
                    </select>
                    <where>
                        <eq op1="succeeded" op2="true"/>
                    </where>
                </query> 
            </then>
            <else>
                <query uri="${client.stats.uri}"
                       type="txt"
                       event="${operation.event}"
                       cursor="cscursor">
                    <select>
                        <field name="${operation.field}"/>
                        <field name="client"/>
                    </select>
                    <where>
                        <and>
                            <eq op1="succeeded" op2="true"/>
                            <eq op1="runid" op2="${runid}"/>
                        </and>
                    </where>
                </query> 
            </else>
        </if>
        
        <if>
            <eq op1="${operation.name}" op2="query"/>
            <then>
                <local>
                    <property name="title" value="${md.type} ${operation.name}"/>
                </local>
            </then>
            <else>
                <local>
                    <property name="title" value="${operation.name} ${filesize} byte objects."/>
                </local>
            </else> 
        </if>
       
        <graph uri="${output}" type="${hc.graph.type}" title="${title}">
            <series name="${operation.name} ${operation.units}"
                    cursor="cscursor" 
                    mode="histogram"
                    sampleunit="1s"/> 
        </graph>
    </function>
    
    <function name="graphBytesPerSecond">
        <param name="operation.name" type="required"/>
        <param name="operation.event" type="required"/>
        <param name="operation.field" type="required"/>
        <param name="operation.units" type="required"/>
        
        <param name="filesize" type="required"/>
        <param name="client.stats.uri" type="required"/>
        <param name="output" type="required"/>
       
        <if>
            <eq op1="${runid}" op2="notset"/>
            <then>
                <query uri="${client.stats.uri}"
                       type="txt"
                       event="${operation.event}"
                       cursor="cscursor">
                    <select>
                        <field name="${operation.field}"/>
                        <field name="client"/>
                    </select>
                    <where>
                        <eq op1="succeeded" op2="true"/>
                    </where>
                </query> 
            </then>
            <else>
                <query uri="${client.stats.uri}"
                       type="txt"
                       event="${operation.event}"
                       cursor="cscursor">
                    <select>
                        <field name="${operation.field}"/>
                        <field name="client"/>
                    </select>
                    <where>
                        <and>
                            <eq op1="succeeded" op2="true"/>
                            <eq op1="runid" op2="${runid}"/>
                        </and>
                    </where>
                </query> 
            </else>
        </if>
        
        <if>
            <eq op1="${operation.name}" op2="query"/>
            <then>
                <local>
                    <property name="title" value="${md.type} ${operation.name}"/>
                </local>
            </then>
            <else>
                <local>
                    <property name="title" value="${operation.name} ${filesize} byte objects."/>
                </local>
            </else> 
        </if>
            
        <graph uri="${output}" type="${hc.graph.type}" title="${title}">
            <series name="${operation.name} ${operation.units}"
                    cursor="cscursor" 
                    aggregateby="${operation.field}"
                    aggfunc="sum"
                    sampleunit="1s"/> 
        </graph>
    </function>
    
    <if>
        <eq op1="${hc.operation}" op2="query"/>
        <then>
            <local>
                <property name="field" value="results"/>
                <property name="units" value="results/sec"/>
            </local>
        </then>
    </if>
    
    <if>
        <eq op1="${hc.operation}" op2="retrievemd"/>
        <then>
            <local>
                <property name="field" value="fields"/>
                <property name="units" value="fields/sec"/>
            </local>
        </then>
    </if>
    
    <local>
        <property name="field" value="size"/>
        <property name="units" value="bytes/sec"/>
    </local>
    
    <if>
        <eq op1="${hc.storewithmd}" op2="true"/>
        <then>
            <local>
                <property name="delete.md.type" value="md"/>
            </local>
        </then>
        <else>
            <local>
                <property name="delete.md.type" value="data"/>
            </local>
        </else>
    </if>

    <if>
        <eq op1="${hc.operation}" op2="delete"/>
        <then>
            <local>
                <property name="stats.uri" 
                          value="storage://OUTPUT/${hc.operation}_${delete.md.type}_perf_${hc.filesize}.txt"/>
                <property name="output.ops" 
                          value="storage://OUTPUT/${hc.operation}_${delete.md.type}_${hc.filesize}_ops_per_second.${hc.graph.type}"/>
                <property name="output.results"
                          value="storage://OUTPUT/${hc.operation}_${delete.md.type}_${hc.filesize}_bytes_per_second.${hc.graph.type}"/>
            </local>
        </then>
    </if>
           
    <if>
        <eq op1="${hc.operation}" op2="query"/>
        <then>
            <local>
                <property name="stats.uri" 
                          value="storage://OUTPUT/${hc.operation}_${md.type}_perf.txt"/>
                <property name="output.ops" 
                          value="storage://OUTPUT/${hc.operation}_${md.type}_ops_per_second.${hc.graph.type}"/>
                <property name="output.results"
                          value="storage://OUTPUT/${hc.operation}_${md.type}_results_per_second.${hc.graph.type}"/>
            </local>
        </then>
    </if>
            
    <local>
        <property name="stats.uri" 
                  value="storage://OUTPUT/${hc.operation}_perf_${hc.filesize}.txt"/>
        <property name="output.ops" 
                  value="storage://OUTPUT/${hc.operation}_${hc.filesize}_ops_per_second.${hc.graph.type}"/>
        <property name="output.results"
                  value="storage://OUTPUT/${hc.operation}_${hc.filesize}_bytes_per_second.${hc.graph.type}"/>
    </local>
            
    <call function="graphOpsPerSecond">
        <property name="operation.name"   value="${hc.operation}"/>
        <property name="operation.event"  value="hc.${hc.operation}"/>
        <property name="operation.field"  value="${field}"/>
        <property name="operation.units"  value="ops/s"/>
                
        <property name="filesize"         value="${hc.filesize}"/>
        <property name="client.stats.uri" value="${stats.uri}"/>
        <property name="output" value="${output.ops}"/>
    </call>
                
    <call function="graphBytesPerSecond">
        <property name="operation.name"   value="${hc.operation}"/>
        <property name="operation.event"  value="hc.${hc.operation}"/>
        <property name="operation.field"  value="${field}"/>
        <property name="operation.units"  value="${units}"/>
                
        <property name="filesize"         value="${hc.filesize}"/>
        <property name="client.stats.uri" value="${stats.uri}"/>
        <property name="output" value="${output.results}"/>
    </call>
    
</script>